"question","answer"
"what is terminal","A command-line interface."
"what is shell","Interface to interact with the OS."
"what is api integration","Connecting two systems using API."
"how to debug code","Find errors by checking logs and tests."
"what is stack overflow","A popular site for programming help."
"what is runtime error","Error during program execution."
"what is syntax error","Wrong grammar in code."
"what is logical error","Correct syntax but wrong output."
"what is database table","A structured collection of data rows."
"what is schema","Layout of database structure."
"what is query","A request for data from a database."
"what is route in web apps","A path for handling requests."
"what is endpoint","URL where API processes requests."
"what is encryption","Securing data by converting it into unreadable form."
"what is decryption","Converting encrypted data back."
"what is authentication","Verifying user identity."
"what is authorization","Giving access based on permissions."
"why do phones update","To improve performance and security."
"why does internet disconnect","Weak signal or router issues."
"why is battery swelling","Damage or manufacturing defect."
"what is hotspot","Using device to share internet."
"what is airplane mode","Disables all wireless communication."
"what is sim card","Subscriber identity module for network access."
"what is imei number","A unique identifier for mobile devices."
"what is screenshot","Image capture of device screen."
"what is screen record","Video capture of screen activity."
"what is cache","Temporary data stored for fast performance."
"how to clear cache","Clear from settings or browser."
"why is my phone slow","Full storage or many background apps."
"how to backup data","Use cloud or external storage."
"what is google drive","A cloud storage service from Google."
"what is onedrive","Microsoft cloud storage service."
"what is icloud","Apple’s cloud storage service."
"what is wallpaper","Background image on device."
"what is ringtone","Audio played during incoming calls."
"what is notification","Alert message from apps or system."
"how to reduce notifications","Turn off unnecessary app alerts."
"what is bluetooth","Wireless tech for short-range communication."
"what is wifi","Wireless internet connectivity."
"what is lan","Local area network."
"what is wan","Wide area network."
"what is router","Device distributing internet connection."
"what is modem","Device converting signals for internet."
"what is 4g","Fourth-generation mobile network."
"what is 5g","Faster fifth-generation network."
"why do we celebrate festivals","To honor traditions, culture, and joy."
"what is birthday","Celebration of birth anniversary."
"what is anniversary","Celebration of a special event yearly."
"why do people get married","For companionship, love, and partnership."
"what is happiness","A positive emotional state of joy."
"what is anger","Strong feeling of displeasure or frustration."
"what is sadness","Emotional pain or disappointment."
"why do we smile","Expression of joy or friendliness."
"what is crying","Emotional response involving tears."
"why do people blush","Blood rushes to the cheeks due to emotions."
"why do humans get shocked","Surprise triggers body’s adrenaline."
"how to talk confidently","Speak slowly and clearly; practice helps."
"how to reduce shyness","Start with small conversations."
"how to improve memory","Use repetition and mental association."
"how to improve focus","Remove distractions and take short breaks."
"how to learn fast","Understand concepts instead of memorizing."
"how to stop bad habits","Replace them with better habits."
"how to wake up early","Sleep early and avoid screens before bed."
"why do we celebrate new year","To mark a new beginning."
"what is culture","Beliefs and customs of a society."
"what is tradition","Practices passed through generations."
"what is religion","A belief system guiding life and values."
"why do humans fear failure","Because failure feels like a threat to confidence and identity."
"how to overcome fear of failure","Focus on learning, not on perfection."
"why do people judge others","People judge based on insecurities or limited understanding."
"why am i insecure","Insecurity comes from comparison or past experiences."
"how to stop insecurity","Focus on your strengths and small achievements."
"what makes people happy","Good relationships, purpose, and gratitude."
"why do humans love music","Music affects brain chemicals like dopamine."
"why do songs get stuck in head","It’s called an earworm, caused by repetition."
"how to stop overthinking at night","Write thoughts down or practice deep breathing."
"why do i forget things","Stress, lack of rest, or too much information."
"how to improve vocabulary","Read daily and use new words in sentences."
"how to be productive","Plan tasks and remove distractions."
"why am i tired every day","Sleep schedule, stress, or low nutrition."
"what is positivity","A mindset focused on good outcomes."
"how to stay positive","Practice gratitude and avoid negative triggers."
"why do we cry when sad","Tears release emotional stress."
"why am i nervous around people","Social anxiety or lack of confidence."
"how to start conversation","Begin with simple questions or compliments."
"why do people avoid me","Maybe they misunderstand you or feel shy too."
"how to make someone smile","Say something kind or thoughtful."
"why am i bored","Lack of stimulation or motivation."
"how to stop boredom","Try a new hobby or learn something interesting."
"why do humans lie to themselves","To avoid emotional discomfort."
"why do people ignore messages","Busy schedules or emotional distance."
"how to stop being sensitive","Build emotional resilience slowly."
"what is attachment","A strong emotional bond with someone."
"why do breakups hurt","Loss of connection triggers emotional pain."
"how to move on","Focus on healing, growth, and new habits."
"why am i angry all the time","Unresolved stress or emotional triggers."
"how to control anger","Pause, breathe deeply, and observe thoughts."
"why do people gossip about me","People talk when they lack understanding."
"why do i feel empty","Emotional burnout or lack of purpose."
"how to find purpose","Explore interests and help others."
"what is empathy","Understanding and sharing others’ feelings."
"what is sympathy","Feeling concern for someone’s suffering."
"why do people change","Life experiences change perspectives."
"why do friendships fade","Lack of communication or different priorities."
"how to rebuild confidence","Celebrate small wins and challenge fears."
"what is attraction","A natural pull toward someone or something."
"why do humans feel jealous","Fear of losing attention or value."
"why do people compare themselves","To measure progress, sometimes negatively."
"how to stop comparison","Focus on your own path."
"why do we feel lost sometimes","Uncertainty about direction or purpose."
"how to feel motivated again","Start small and reconnect with goals."
"why do people ghost","Avoidance or emotional discomfort."
"how to handle rejection","See it as redirection, not failure."
"why do we crave approval","Humans seek belonging and acceptance."
"how to build discipline","Stay consistent even when unmotivated."
"why am i scared to talk to strangers","Fear of judgment or awkwardness."
"how to overcome shyness","Start with short interactions daily."
"why do humans need friends","For emotional support and belonging."
"what is loneliness","Feeling disconnected even when around people."
"how to reduce loneliness","Connect with supportive people and activities."
"why do i lose interest quickly","Lack of challenge or mental fatigue."
"how to build patience","Practice waiting without distraction."
"why do people lie in relationships","Fear, insecurity, or poor communication."
"how to trust again","Give time and observe consistency."
"why do humans love challenges","Challenges stimulate growth and satisfaction."
"why do people have dreams in life","Dreams provide direction and hope."
"how to find happiness","Focus on small joys and meaningful connections."
"why do people cry when laughing","Strong emotions trigger tear glands."
"why do humans blush","Blood rushes to the face due to emotions."
"what is disappointment","Emotion when reality doesn’t match expectations."
"why am i disappointed easily","Because expectations are too high or unclear."
"how to reduce expectations","Focus on efforts, not outcomes."
"what is emotional maturity","Handling emotions calmly and responsibly."
"how to improve emotional maturity","Reflect before reacting."
"why do humans crave love","Love provides safety, connection, and purpose."
"why do people act rude","Stress, insecurity, or lack of empathy."
"how to deal with rude people","Stay calm and avoid reacting emotionally."
"why do people get attached easily","They value connection deeply."
"what is trauma","Emotional shock caused by distressing events."
"how to heal trauma","Slow processing, support, and self-care."
"why do i feel demotivated","Burnout or unclear goals."
"how to regain focus","Remove distractions and break tasks down."
"what is introvert","Someone who gains energy from solitude."
"what is extrovert","Someone who gains energy from social interaction."
"what is ambivert","A mix of introvert and extrovert traits."
"why do people feel regret","Thinking about missed opportunities."
"how to stop regret","Focus on what can be done next."
"what is gratitude","Feeling thankful for what you have."
"how to practice gratitude","Write daily things you’re thankful for."
"why do humans fear change","Change feels uncertain and risky."
"how to adapt to change","Take small steps and stay open-minded."
"why do people brag","To feel important or respected."
"how to deal with braggers","Acknowledge politely and change topic."
"what is success","Achieving goals that matter to you."
"how to be successful","Be consistent and keep learning."
"why do people fail","Lack of consistency or wrong strategy."
"how to learn from failure","Analyze mistakes and improve approach."
"why do people hesitate","Fear of judgment or mistakes."
"how to stop hesitation","Take action immediately."
"why do humans love compliments","They boost confidence and positivity."
"how to compliment someone","Be honest and specific."
"what is maturity","Ability to handle situations wisely."
"how to be mature","Think long-term, not emotionally."
"why do humans feel guilty","Conscience reacts to wrongdoing."
"how to handle guilt","Accept, apologize, and improve."
"why do we celebrate birthdays","To appreciate life and experiences."
"what is self respect","Valuing yourself and your boundaries."
"how to build self respect","Avoid things that hurt your dignity."
"why do humans fear death","Fear of unknown or separation."
"what is courage","Facing fear despite being afraid."
"how to be brave","Take small steps outside comfort zone."
"why do people give up","Lack of support or discouragement."
"how to never give up","Focus on purpose, not difficulties."
"what is kindness","Acting with care and compassion."
"how to be kind","Help others without expecting return."
"why do people misunderstand me","Communication gap or unclear tone."
"how to communicate better","Speak clearly and listen actively."
"why do people feel insecure in relationships","Fear of loss or inadequacy."
"how to build strong relationships","Trust, honesty, and communication."
"why do people quit jobs","Stress, growth, or dissatisfaction."
"how to choose a career","Follow interests and strengths."
"why do humans forget names","Too many distractions during introductions."
"how to remember names","Repeat the name as soon as you hear it."
"why do we get goosebumps","Reaction to cold or strong emotions."
"why do humans snore","Blocked airways during sleep."
"why do people sleepwalk","Sleep cycle disruption."
"what is anxiety","Fear or worry about future events."
"how to calm anxiety","Deep breathing and grounding techniques."
"why do people love pets","Pets provide unconditional love and comfort."
"what is responsibility","Handling commitments properly."
"how to be responsible","Complete tasks on time."
"why am i scared to try new things","Fear of failure or embarrassment."
"how to start new habits","Begin small and stay consistent."
"why do people crave attention","To feel valued or noticed."
"how to stop seeking attention","Be comfortable with yourself first."
"what is daydreaming","Mind wandering to imagined scenarios."
"why do people daydream","To escape reality or explore creativity."
"why do i feel uncomfortable in crowds","Social anxiety or overstimulation."
"how to handle social events","Plan ahead and take breaks."
"why do humans laugh","Laughter releases stress and bonds people."
"why do we get surprised","Unexpected events trigger sudden reactions."
"why do humans sweat","To cool down the body."
"why do we shiver","Body produces heat in cold conditions."
"why do humans sneeze","To clear irritants from the nose."
"why do we get hiccups","Spasms of the diaphragm muscle."
"what is stamina","Ability to sustain physical effort."
"how to increase stamina","Exercise regularly and eat healthy."
"why do people faint","Low blood flow to the brain."
"what is concentration","Focusing attention on a task."
"how to build concentration","Eliminate distractions and practice regularly."
"why do humans feel shy","Fear of judgment or unfamiliarity."
"how to break the ice","Start with simple questions."
"why do people take risks","For excitement or potential rewards."
"how to take smart risks","Analyze before acting."
"what is fear","A natural response to danger."
"why do people make mistakes","Because humans are imperfect."
"how to learn quickly","Connect concepts with real-life examples."
"why is honesty important","It builds trust and respect."
"what is hope","Belief that things will get better."
"why do people give advice","To help or to share experience."
"how to accept failure","See it as part of growth."
"why am i always distracted","Lack of interest or too many triggers."
"how to remove distractions","Turn off notifications and create a routine."
"what is passion","Strong enthusiasm for something."
"how to find passion","Try different things and see what excites you."
"why do people argue","Different opinions or emotions."
"how to stop arguing","Listen calmly and speak respectfully."
"why do humans break promises","Pressure or lack of commitment."
"how to keep promises","Avoid commitments you can't fulfill."
"what is mental strength","Ability to stay calm in difficult times."
"how to build mental strength","Face challenges instead of avoiding them."
"why do people lack confidence","Negative experiences or comparisons."
"how to boost confidence naturally","Improve skills and celebrate progress."
"what is guilt","Feeling bad for doing something wrong."
"why do people apologize","To fix relationships and show remorse."
"why do humans blush","Due to embarrassment or strong emotion."
"why do couples fight","Miscommunication and expectations."
"how to solve relationship issues","Talk openly and respectfully."
"what is depression","A mental condition involving deep sadness."
"how to reduce sadness","Talk to someone supportive and take small actions."
"why am i frustrated","Too many stress factors at once."
"how to calm frustration","Breathe slowly and take breaks."
"why do people get angry easily","Low tolerance or emotional load."
"how to improve emotional control","Pause before reacting."
"why am i scared to fail","Fear of judgment or disappointment."
"how to kill fear","Face it gradually with small steps."
"why do people panic","Sudden overwhelming fear."
"how to stop panic","Ground yourself with breathing exercises."
"why do humans love stories","Stories create emotion and imagination."
"what is curiosity","Desire to learn and explore."
"why are humans curious","Curiosity leads to growth and survival."
"what is stress","Pressure felt by mind or body."
"how to reduce exam stress","Study early and revise in intervals."
"why do people feel pressure","Expectations from self or others."
"how to handle pressure","Stay organized and calm."
"why do humans love challenges","It makes them feel capable and strong."
"how to improve body language","Stand straight, smile, and maintain eye contact."
"what is self love","Appreciating and valuing yourself."
"how to practice self love","Be kind to yourself and set boundaries."
"what is respect","Treating someone with dignity."
"how to earn respect","Be honest, kind, and reliable."
"why do people feel jealous in relationships","Fear of losing someone."
"how to stop jealousy","Build trust and self-esteem."
"why do people hide feelings","Fear of vulnerability or judgment."
"how to express feelings","Speak honestly and calmly."
"why do humans feel stressed easily","Because the brain reacts quickly to overload or pressure."
"how to keep mind calm","Breathe slowly and focus on one thought at a time."
"why am i scared of opinions","Because judgment feels threatening."
"how to ignore negativity","Focus on your goals, not on critics."
"what is ego","An inflated sense of self-importance."
"how to control ego","Practice humility and listen more."
"why do people overreact","Strong emotions override logic."
"how to control reaction","Pause before responding."
"why do humans crave success","It brings validation and happiness."
"how to handle criticism","Accept what is useful, ignore the rest."
"why do people cheat","Lack of discipline, honesty, or commitment."
"how to avoid jealousy","Work on self-confidence."
"why do people brag about achievements","To seek attention or approval."
"how to handle bragging","Stay neutral and don’t compare."
"why do humans get irritated","Stress, noise, or unmet expectations."
"how to stay patient","Practice waiting without frustration."
"why do I forget what I study","Brain needs repetition to store memory."
"how to improve memory","Review regularly and sleep well."
"why do humans gossip","To feel connected or distract themselves."
"how to avoid gossip","Change topic or stay silent."
"why do friendships break","Trust issues or lack of communication."
"how to fix a broken friendship","Talk openly and apologize if needed."
"why do people get offended","Because emotions override logic."
"how to avoid offending others","Speak respectfully and clearly."
"why am I lazy","Lack of interest or energy."
"how to stop laziness","Start with small, easy tasks."
"why do people procrastinate","Fear of failure or boredom."
"how to stop procrastination","Do tasks for just 2 minutes to start."
"why do humans feel lonely in crowds","Emotional disconnect from others."
"how to feel confident socially","Practice small interactions daily."
"why do people feel empty inside","Lack of purpose or burnout."
"how to fill emotional emptiness","Build habits, purpose, and relationships."
"why do people cry when angry","Overload of emotions triggers tears."
"how to calm anger fast","Drink water and take deep breaths."
"why do humans get addicted","Brain gets used to reward chemicals."
"how to break addiction","Replace unhealthy habits with positive ones."
"why am I overthinking everything","Anxiety or lack of clarity."
"how to stop overthinking","Focus on present actions, not future fears."
"why do I care what others think","Humans naturally seek approval."
"how to stop caring about opinions","Believe in your decisions first."
"why do people judge quickly","Instinctive mental shortcuts."
"how to stop judging others","Try to understand their story."
"why am I sensitive","Strong emotional awareness."
"how to become less sensitive","Set boundaries and practice emotional control."
"why do humans dream","Brain processes memories and emotions."
"why do dreams feel real","Brain is active like you’re awake."
"why am I scared of darkness","Unknown things trigger fear."
"how to remove fear of darkness","Use small lights and practice staying calm."
"why do people fear public speaking","Fear of embarrassment or judgement."
"how to speak confidently","Prepare and practice regularly."
"why am I addicted to phone","Dopamine reward loop."
"how to reduce phone addiction","Turn off notifications and set limits."
"why do people lie","To hide truth or avoid conflict."
"how to detect lies","Watch body language and inconsistencies."
"why do humans fight","Due to anger, pride, or misunderstanding."
"how to stop fights","Stay calm and understand the other person."
"why do humans need sleep","For memory, healing, and energy."
"why am I always sleepy","Poor sleep cycle or improper diet."
"how to fix sleep cycle","Sleep at the same time daily."
"why do humans fear rejection","It feels like emotional danger."
"how to handle rejection","Focus on self-growth, not approval."
"why do people neglect us","Priorities change or they’re busy."
"how to deal with neglect","Communicate honestly and focus on yourself."
"why am I losing friends","Different interests or communication gaps."
"how to make new friends","Join groups or talk to new people."
"why do people show attitude","Insecurity or desire for attention."
"how to deal with attitude","Stay calm and don’t take it personally."
"why do people feel shy around crush","Fear of judgment or messing up."
"how to talk to crush","Be simple and confident."
"why do relationships fail","Lack of communication or trust."
"how to save relationship","Talk openly and spend quality time."
"why am I scared of commitment","Fear of responsibility or losing freedom."
"what is true love","Respect, loyalty, and understanding."
"why do people flirt","To show interest or attraction."
"why do humans crave touch","It creates comfort and connection."
"how to be more confident","Improve posture, mindset, and skills."
"why do people make excuses","To avoid responsibility."
"how to stop making excuses","Accept mistakes and take action."
"why am I short tempered","Stress buildup or lack of sleep."
"how to control short temper","Practice patience daily."
"why do people fear loneliness","Humans are social beings."
"how to enjoy solitude","Develop hobbies and self-love."
"why do people cling to past","Because memories feel safe."
"how to let go of past","Accept, forgive, and move forward."
"why do humans lie to themselves","To avoid emotional truth."
"how to accept reality","Face things calmly and logically."
"why do I hesitate to ask questions","Fear of looking foolish."
"how to ask confidently","Remember everyone learns by asking."
"why do humans take things personally","Because emotions overpower logic."
"how to stop taking things personally","Understand it’s not about you."
"why do people lose motivation","Burnout or unmet expectations."
"how to stay motivated daily","Set small achievable targets."
"why do humans criticize others","To feel superior."
"how to handle criticism positively","Learn what helps and ignore the rest."
"why am I stressed for no reason","Hidden worries or overthinking."
"how to reduce brain stress","Meditate or take a short break."
"why do people panic suddenly","Brain misreads situations as threats."
"how to handle panic attack","Take deep breaths and ground yourself."
"why do humans forget childhood memories","Brain filters old info."
"how to remember childhood events","Look at photos or talk to family."
"why am I scared of failure","Fear of judgment or losing value."
"how to embrace failure","Use failure as experience."
"why do people see nightmares","Stress or irregular sleep."
"how to stop nightmares","Relax before sleeping."
"why do humans feel anxious socially","Fear of judgement."
"how to reduce social anxiety","Practice conversations gradually."
"why do people blush easily","Overactive nervous system."
"how to stop blushing","Control breathing and stay calm."
"why am I scared of being alone","Fear of emotions or silence."
"how to overcome fear of being alone","Spend time knowing yourself."
"why do people act fake","To fit in or gain approval."
"how to identify fake people","Check consistency over time."
"why do humans get insecure in relationships","Fear of losing someone."
"how to remove relationship insecurity","Communicate openly."
"why do I forget what I speak","Anxiety interrupts thoughts."
"how to speak clearly","Slow down and breathe."
"why do humans cry when happy","Strong emotions overwhelm brain."
"why do people chase money","Money provides comfort and security."
"how to manage money","Budget and save monthly."
"why am I scared to try new things","Fear of the unknown."
"how to build courage","Take small risks."
"why do humans crave validation","Validation boosts self-worth."
"how to validate yourself","Be proud of small achievements."
"why do people overthink small things","Brain exaggerates threats."
"how to calm mind","Focus on breathing."
"why do I feel useless","Temporary emotional burnout."
"how to feel valuable","Work on skills and help others."
"why am I attached to toxic people","Because of emotional patterns."
"how to detach from toxicity","Set boundaries and reduce contact."
"why do humans regret decisions","Because future becomes clearer later."
"how to avoid regret","Think long-term before deciding."
"why do I worry about future","Fear of uncertainty."
"how to stop future anxiety","Focus on current actions."
"why do people forgive","To release emotional weight."
"why is forgiveness hard","Ego and pain block healing."
"how to forgive someone","Understand their perspective."
"why do humans lie in love","Fear of losing connection."
