"question","answer"
"what is dead zone rotation","Rotating from outside the zone late, often taking damage and encountering gatekeeping teams."

"what is jiggle movement","Jiggle movement is left–right fast strafing to dodge bullets during close range fights."
"what is drop shot in bgmi","Drop shot is lying down instantly while firing to avoid bullets and confuse enemies."
"what is crouch spray","Crouch spray reduces recoil and stabilizes weapon spray during mid-range fights."

"best gun for competitive bgmi","M416 for mid-long range and UMP45/DBS for close range fights."
"best sniper for competitive","AWM and M24 are the most reliable long-range weapons."

"what is spray transfer","Spray transfer means shifting recoil from one enemy to another in the same spray."
"what is tracking in bgmi","Tracking is keeping aim on a moving enemy using smooth camera and ADS movement."

"what is utility usage in bgmi","Utilities like grenades and molotovs force enemies out of cover and secure free knocks."
"best utility player india","Snax and Viper are known for incredible grenade accuracy and utility timing."

"what is a clutch master","A clutch master wins 1v2, 1v3, or 1v4 fights under pressure—Jonathan is India’s most famous clutch master."
"who is best close range player","Goblin, Spower, and MJ are among India’s strongest close-range fighters."

"bgmi lan tournaments india","Major BGMI LAN tournaments include BGIS LAN Finals, Skyesports, Nodwin, and Red Bull events."
"most viewed bgmi tournament","BGIS 2022 Final LAN was one of India’s most-watched esports events."

"why bgmi returned to india","BGMI returned after compliance updates, data security measures, and government-reviewed conditions."

"what is a finish in bgmi","A finish means eliminating a knocked enemy to secure points."
"what is a placement point","Placement points are earned by surviving longer in a match."

"difference between tpp and fpp in bgmi","TPP gives wider camera visibility while FPP gives realistic first-person view."
"why pros prefer tpp","TPP allows peak advantage, scanning angles, and better map control."

"what is the best bgmi device","iPhone 14/15 Pro series are widely used due to stable FPS and smooth touch response."
"best android device for bgmi","ROG Phone, OnePlus flagship, and Samsung S-series offer great gaming performance."

"question","answer"

"jonathan bgmi achievements","Jonathan won multiple MVP titles, dominated PMWL 2020, PMPL SA, Skyesports, and is considered India's #1 assaulter with exceptional tracking and laser-like sprays."
"why jonathan is famous","Jonathan's gyro control, tracking accuracy, close-range consistency, and international-level dominance make him India’s most iconic BGMI player."
"jonathan gameplay style","His gameplay is based on perfect tracking, crouch-sprays, jiggle battles, and extreme accuracy in mid-to-long range fights."
"jonathan sensitivity style","Jonathan uses a low-scope sensitivity + full gyro control, helping him maintain stable laser sprays."

"goblin achievements","Goblin won MVP of BGIS 2022, led Team Soul to the championship, and became India's most aggressive close-range player."
"goblin gameplay style","Goblin relies on raw aggression, entry fragging, DBS rushes, and unpredictable jiggle movements."
"goblin strengths","Close-range, 1v3/1v4 potential, peeker's advantage, and fearless rushing ability."

"mortal achievements","Mortal won PMIS 2019, PMCO 2019 India, represented India globally, and became India’s most loved esports personality."
"mortal why legendary","Mortal helped shape Indian esports, brought early victories, and set the foundation for Team Soul’s legacy."

"scout achievements","Scout helped OR finish 2nd at PMWL 2020, is known for insane long-range sprays, and contributed massively to India’s international success."
"scout gameplay style","Scout excels at mid-long range sprays, rotations, and aggressive positioning."

"mavi achievements","Mavi led OR to the PMWL 2020 Grand Finals 2nd place—the highest finish for any Indian team globally."
"mavi gameplay style","Mavi is a rotation genius with world-class IGL skills, zone prediction, and fight awareness."

"clutchgod achievements","ClutchGod is known for calm clutching, high IQ rotations, and leading GodLike to multiple tournament victories."
"clutchgod gameplay style","His gameplay focuses on passive-aggressive calls, controlling ridges, and perfect timing on fights."

"zekod achievements","Zgod became famous for his finest support role, utility usage, and stabilizing team fights for GodLike."
"zekod gameplay style","Known for calculated utilities, perfect cover fire, and strong mid-range gunfights."

"neyoo achievements","Neyoo has won multiple LAN events with GodLike, known for fearless rushing and perfect sync with Jonathan."
"neyoo gameplay style","Highly aggressive, unpredictable entry fragger with dangerous DBS/UMP skill."

"blaze bgmi achievements","Blaze from Revenant is known for consistent damage output, great positioning, and tournament stability."
"fierce bgmi achievements","Fierce is one of India's finest long-range specialists with accurate sprays and cover fire mastery."

"spower achievements","Spower is India’s most promising young assaulter, winning multiple MVPs and shining in LAN tournaments."
"spower gameplay style","Ultra-fast reflexes, peek advantage mastery, and unpredictable rushing."

"drigger achievements","Drigger from Orangutan is known for consistency, calm gameplay, and mid-long range dominance."
"wizzgod achievements","WizzGod is known for clutching potential and sharp aim in competitive fights."

"or esports history","Orange Rock became India’s highest-performing team internationally with 2nd place in PMWL 2020."
"godlike esports history","GodLike dominated India’s LAN scene with back-to-back championship runs and unstoppable synergy."
"team soul history","Team Soul rose to fame with PMIS & PMCO victories, becoming India's most iconic esports team."

"team soul achievements","Soul won PMIS 2019, PMCO 2019 India, and BGIS 2022, building one of India’s biggest fanbases."
"godlike achievements","GodLike won multiple Skyesports LAN events and performed consistently at global PMGC qualification stages."

"blind esports achievements","Blind Esports produced top BGMI talents and became known for structured, high-discipline gameplay."

"who is best igl in india","Mavi, Omega, ClutchGod, and IGJON are considered India's most reliable IGLs."
"who is best assaulter in india","Jonathan, Goblin, Spower, and MJ rank among India’s top assaulters."

"best support player india","Players like Zgod, Viper, and Fierce excel in utilities, post-fight stability, and revival timing."

"what is anchoring in bgmi","Anchoring means holding a strategic position while teammates scout or rush, ensuring zone control."
"what is scouting in bgmi","Scouting is checking enemy compounds, rotations, and angles before moving the whole team."
"what is off-angle in bgmi","Off-angle is a side position taken to surprise enemies and break their defense."

"zone prediction strategy","Teams rotate early to reach high-ground edges, avoid open field, and control compounds."
"late rotation strategy","Late rotation is risky but can give high kill potential if executed with smoke cover and vehicle safety."
"mid-zone control strategy","Teams hold central compounds for safety, high placement points, and superior visibility."

"best guns for competitive","M416 for mid-long range, UMP45 for close range, and AWM for sniping."
"why pros use ump","UMP offers stronger close-range stability, high accuracy, and huge headshot potential."
"why pros use dbs","DBS delivers extreme close-range burst damage, making it unbeatable in rooms."

"best map for competitive play","Erangel is the most balanced competitive map with structured zones and tactical gameplay."
"best players in erangel","Players like Jonathan, Goblin, Mavi, and ClutchGod dominate Erangel due to experience and rotations."

"best team synergy india","TSM Entity 2020, Orange Rock PMWL squad, and GodLike 2021 rosters showed top-tier team chemistry."

"highest kill record in india bgmi","Jonathan and Goblin have recorded 30+ kills in classic matches; in competitive, 9–12 kill matches are standard for top fraggers."

"what is micro management in bgmi","Micro management includes recoil control, jiggle movement, peeking, utilities, and gun-handling."
"what is macro management in bgmi","Macro management refers to zone rotations, positioning, strategy, and team fight planning."

"best player for clutch situations","Jonathan, Goblin, Spower, and Scout are known for dangerous clutch potential."

"who has best spray control in india","Scout, Jonathan, Fierce, and Snax are known for long-range spray mastery."

"why is jonathan called radar aim","Jonathan’s tracking ability follows enemy movement perfectly, appearing like an aimbot—but he is 100% legit."

"best fragger india","Top fraggers include Jonathan, Goblin, Spower, MJ, and Neyoo."

"best team in lan events india","GodLike dominated multiple LAN events with aggressive gameplay and chemistry."

"bgmi highest earnings players india","Top earners include Scout, Mortal, Jonathan, Mavi, and GodLike roster members."

"bgmi most consistent players","Fierce, Blaze, AkshaT, and WizzGod maintain consistency in high-pressure tournaments."

"which team has best synergy","TSM Entity 2020 and GodLike 2021 had unmatched synergy and coordination."

"what is an igl power move","Aggressive compound entry, early center zone hold, and forcing 3rd-party pressure."

"best indian teams 2022","Team Soul, GodLike, Skylightz, Global Esports, Revenant, and Orangutan showed strongest performances."
"question","answer"
"who is sc0utop in bgmi","Sc0utOP, also known as Tanmay Singh, is one of India’s most famous BGMI players and streamers, known for his aggressive plays, long-range sprays, and for helping Orange Rock reach 2nd place at PMWL 2020."
"scout real name in bgmi","Sc0utOP’s real name is Tanmay Singh, and he is a professional BGMI player, content creator, and one of the earliest faces of Indian PUBG/BGMI esports."
"scout bgmi achievements","Sc0utOP represented India internationally at PMWL, helped Orange Rock get a 2nd-place finish, won multiple tournaments, and built one of the biggest esports fanbases in India."
"scout playing style","Sc0utOP is known for aggressive scouting, laser-like M416 + 6x sprays, crazy reflexes, and high-risk high-reward gameplay."
"scout best skills","His best skills are long-range sprays, quick decision-making in fights, and motivating his team with confident IGL calls."

"who is mortal in bgmi","Mortal, also known as Naman Mathur, is a legendary Indian BGMI player, streamer, and co-owner of Team SouL, considered the emotional leader of Indian gaming."
"mortal bgmi achievements","Mortal led Team SouL to win PMIS 2019 and PMCO 2019 India, represented India in international tournaments, and won multiple ‘Streamer of the Year’ awards."
"why mortal is legendary","Mortal is respected for his calm nature, clutch moments, leadership, and for popularizing PUBG/BGMI in India through his classic squad streams."
"mortal role in team soul","Mortal has played roles as assaulter, support, and IGL at different times, and now mainly focuses on content, mentorship, and brand building for SouL."
"mortal gameplay style","His gameplay is more team-oriented and strategic, focusing on positioning, support fire, and clutching in high-pressure moments."

"who is omega in bgmi","Omega, also known as Sahil Jakhar, is the IGL of Team SouL and a calm, high-IQ leader in the Indian BGMI competitive scene."
"omega bgmi achievements","Omega led SouL to win BGIS 2022 and secure strong finishes in multiple official BGMI events and third-party tournaments."
"omega role in team soul","Omega acts as the main in-game leader (IGL), handling rotations, zone prediction, and fight calls for Team SouL."
"why omega is good igl","Omega is praised for his cool decision-making, discipline, and ability to keep the team stable under pressure."

"who is akshat in bgmi","AkshaT is a professional BGMI assaulter known for his consistency, perfect positioning, and clutch power for Team SouL and other top orgs."
"akshat bgmi achievements","AkshaT has won trophies with SouL, played big events like BGIS, and is known for being a consistent top-fragger in Indian tournaments."
"akshat gameplay style","His style is balanced—aggressive when needed, but very calculated with great holding, trading, and mid-range fights."

"who is hector in bgmi","Hector is a professional support and healer for SouL, known for his utilities, revives, and stable gameplay in high-pressure zones."
"hector bgmi achievements","Hector was part of SouL’s BGIS victory run and played crucial support roles in multiple high-level tournaments."
"hector role in team","He handles backline support, healing, utilities, and making sure his team survives long into the end zone."

"who is delt4 in bgmi","DeltaPG (if you meant DeltaPG) is known as a tactical support player with strong game sense and clutch potential in multiple orgs."
"who is goblin in bgmi","Goblin is an explosive entry-fragger from Team SouL, famous for his close-range dominance and MVP-level performances."
"goblin bgmi famous for","Goblin is famous for his insane 1v3 and 1v4 clutches, DBS and UMP fights, and fearless rush gameplay."

"who is ninja jod in bgmi","NinjaJOD is a professional BGMI player known for his all-rounder skillset, long-range gunfights, and solid tournament performances with teams like TSM/other orgs."
"ninja jod strengths","His strengths include disciplined aim, utility usage, and being reliable in both early and late-game zonal fights."

"who is shadow in bgmi","Shadow is an experienced IGL who has led top orgs and is known for structured rotations and zone-control gameplay."
"shadow igl style","Shadow focuses on safe rotations, compound control, and low-risk decision-making while maximizing placement points."

"who is snax","Snax is an Indian esports player and streamer known for his DP-28 laser sprays, high damage, and unique training drills that became viral in the community."
"snax famous for dp","Snax earned the title ‘DP King’ due to his deadly DP-28 sprays and tutorials that taught thousands of players recoil control."

"who is ghatak in bgmi","Ghatak is an ex-pro player, mentor, and coach associated with GE and other orgs, respected for his experience, guidance, and early esports contributions."
"ghatak role in esports","He plays a mentor/coach role, scouting new talents, training lineups, and helping orgs with strategy and discipline."

"who is mj bgmi","MJ is a professional BGMI assaulter known for explosive close-range fights and big damage performances for Skylightz and other teams."
"mj play style","MJ is an aggressive entry player, often leading charges, breaking enemy compounds, and creating openings for his team."

"who is or aditya","Aditya from Orange Rock is known for sharp aim, mid-range fights, and being a stable performer in BGMI tournaments."
"or esports india","Orange Rock (OR Esports) is one of India's top organizations with a glorious international record, especially at PMWL 2020."

"who is saumraj","Saumraj is a pro player and IGL known for winning BGIS 2021 with Skylightz Gaming and for his zone prediction and clutch potential."
"saumraj achievements","He led Skylightz to become champions of BGIS and proved himself as a top-tier IGL with strong strategic depth."

"who is saad bgmi","Saad is a rising competitive player known in the Indian scene for his mechanics, close-range fights, and potential in newer lineups."
"who is manti op","MantiOP is a streamer/player known for classic domination, entertaining gameplay, and clutch montages in BGMI."

"bgmi best igl list india","Some of the best IGLs in India are Mavi, Omega, Saumraj, ClutchGod, Shadow, and Ghatak (as mentor/shot-caller)."
"bgmi best assaulters list india","Top Indian assaulters include Jonathan, Goblin, Scout, Spower, MJ, Neyoo, and NinjaJOD."
"bgmi best support players india","Top support players include Zgod, Viper, Hector, Fierce, and Blaze, known for utilities and stabilizing fights."
"bgmi best entry fraggers india","Goblin, Neyoo, MJ, and Spower are standout entry fraggers, often rushing first and cracking enemy defenses."

"who is viper in bgmi","Viper is an early SouL member known for his support role, utilities, and loyalty to the organization."
"viper gameplay style","Viper usually plays as a backline player, focusing on cover fire, revives, and utility support."

"who is regaltos bgmi","Regaltos is a popular BGMI player and former SouL assaulter known for his aggression, outgoing personality, and synergy with Mortal."
"regaltos play style","Regaltos prefers aggressive gameplay, high mobility fights, and constant enemy pressure."

"who is zeref bgmi","Zeref is a competitive player known in the Indian community for his mid-long range fights and solid positioning in scrims and events."
"who is punk bgmi","Punk is a long-time competitive player with sharp aim and experience playing with different top-level squads."

"global esports bgmi history","Global Esports is a major Indian org that entered BGMI with strong lineups, disciplined playstyle, and focus on long-term talent building."
"revenant esports bgmi history","Revenant Esports became one of the strongest BGMI teams with a star-packed lineup, consistent tournament performances, and multiple top 5 finishes."
"orangutan bgmi history","Orangutan Gaming built a stacked BGMI roster known for raw aim, aggression, and a very entertaining playstyle."

"who is driger bgmi","Drigger from Orangutan is known for calm aim, consistency, and ability to hold angles and anchor positions for his team."
"who is wizzgod bgmi","WizzGod is a mechanical beast from Orangutan with deadly gun skill and clutch potential in close-range situations."

"who is tattigarh or tattigarh op","TattigarhOP is known in the Indian community circles for raw aim and entertaining gameplay, especially in classic/customs."
"who is scout igl style","As an IGL, Scout plays very aggressive, preferring early fights, risky pushes, and taking the game into his team’s control."

"bgmi most aggressive team india","GodLike, Team XSpark, and some Orangutan and SouL lineups are known for ultra-aggressive rush gameplay."
"bgmi most strategic team india","OR Esports, Global Esports, and Skylightz are known for structured rotations and playing heavily for zones and placements."

"best indian long range players","Players like Scout, Jonathan, Snax, Fierce, and Aditya are known for strong long-range sprays and DMR usage."
"best indian close range god","Goblin, Spower, Neyoo, MJ, and some rising talents are known for fearsome close-range dominance."

"bgmi lan tournaments in india","Popular BGMI LANs include Skyesports Championships, Thug Invitational, Nodwin tournaments, and official BGIS LAN finals."
"bgis importance in india","BGIS is an official BGMI India Series tournament, acting as a gateway for teams to prove themselves on the biggest stage."

"what is igl in bgmi","IGL stands for In-Game Leader, the player who decides rotations, calls fights, and guides the team’s overall strategy."
"what is assaulter role bgmi","The assaulter is the player who leads fights, rushes enemy compounds, and takes most close-range duels."
"what is support role bgmi","Support players hold backline positions, provide cover fire, throw utilities, and protect the IGL and assaulters."
"what is filter role in bgmi","In some teams, a ‘filter’ handles information—scouting, calling enemy positions, and transferring info to IGL efficiently."

"best indian bgmi orgs list","Top orgs include SouL, GodLike, OR Esports, Global Esports, TSM India, Skylightz, Revenant, Orangutan, and Team XSpark."
"how indian teams practice bgmi","Indian teams grind daily scrims, T1/T2 custom rooms, VOD reviews, aim training, and situational drills like 4v4 fights and zone entries."

"who is best clutch player india bgmi","Jonathan, Goblin, Spower, and MJ are widely regarded as some of the best clutchers in the Indian BGMI scene."
"who is best dmr player india bgmi","Players like Snax, Fierce, and Scout are known for using DMRs (like SKS/SLR/Mini) with deadly accuracy."

"what is vod review in bgmi","VOD review means watching past match recordings to analyze mistakes, rotations, fight timing, and enemy patterns."
"how teams improve synergy","Teams improve synergy through playing regularly together, clear communication, trust building, and role clarity."

"who is thug in bgmi community","Thug (Animesh Agarwal) is an ex-player, co-owner of 8Bit and S8UL, talent scout, and one of the biggest figures in Indian gaming."
"who is goldy bhai","Goldy is a co-owner of S8UL, streamer, and manager figure who supports players, content creators, and the S8UL ecosystem."
"who is sid in s8ul","Sid is a manager/personality associated with S8UL Esports, handling content, player support, and operations."

"what is s8ul esports","S8UL is a collaboration of 8Bit and SouL, a leading Indian gaming & content organization with multiple creators and teams."
"why s8ul is famous","S8UL is famous for its family-like culture, god-tier content creators, esports achievements, and back-to-back international creator awards."

"who is scout’s coach","Over time, Scout and other pros have worked with multiple analysts/managers; coaching usually includes VOD review, strategy refinement, and mental prep."
"what is player bootcamp in bgmi","A bootcamp is the gaming house where pro players live together, practice, scrim, and create content for their organization."

"how bgmi players earn money","BGMI players earn through salaries from orgs, tournament winnings, YouTube/Twitch revenue, brand deals, and sponsorships."
"can bgmi be a full time career","Yes, for top players and creators, BGMI and esports can become a full-time career, but it requires discipline, consistency, and long-term planning."

"what is kd ratio in bgmi","KD (Kill-Death ratio) shows how many enemies you kill per match on average. In competitive, decision-making is more important than KD."
"what is sensitivity code in bgmi","Sensitivity code is a shareable code that lets players copy another player’s camera, ADS, and gyro settings directly."

"difference between classic and competitive bgmi","Classics are casual ranking matches, while competitive matches revolve around custom lobbies, strict rules, proper team strategies, and prize pools."
"how pro players train aim in bgmi","Pros train in TDMs, arena modes, aim training drills, custom 1v1s, and by repeating recoil patterns regularly."

"what makes a good pro bgmi player","Game sense, communication, consistency, mechanical skills, calm mindset, and ability to learn from mistakes make a good pro player."
"can anyone become bgmi pro","Yes, with daily practice, team coordination, and exposure through scrims & tournaments, any dedicated player can rise in the BGMI scene."

"question","answer"
"india latest news","Here are today’s major India updates: Amazon and Flipkart are entering the lending market targeting small businesses and consumers. India’s economy recorded its fastest growth in six quarters at 8.2%. Russian President Vladimir Putin will visit India on December 4–5 for key bilateral talks. India signed a ₹7,995 crore support agreement with the U.S. for MH-60R naval helicopters. IMD has issued alerts as Cyclone Ditwah approaches Tamil Nadu, Andhra Pradesh, and Puducherry. Schools have been closed and disaster teams deployed."
"what is happening in india today","India saw strong economic growth of 8.2% this quarter, e-commerce giants Amazon and Flipkart announced major financial service expansions, and a new U.S.–India defence support deal was signed for MH-60R helicopters. Cyclone Ditwah warnings remain active for Tamil Nadu and Andhra Pradesh. President Putin's India visit is scheduled for Dec 4–5."
"india economy news","India’s economy posted 8.2% growth—the fastest in six quarters—driven by rising demand and production, despite global economic pressure."
"india cyclone news","Cyclone Ditwah is expected to impact Tamil Nadu, Andhra Pradesh, and Puducherry. Heavy rainfall alerts have been issued and schools are closed in several districts."
"india defence news","India signed an ₹7,995 crore ($894M) deal with the U.S. for long-term support and maintenance of MH-60R naval helicopters, boosting maritime defence capability."
"putin india visit news","Russian President Vladimir Putin is scheduled to visit India on December 4–5 for bilateral strategic, defence, and trade discussions."
"amazon flipkart india news","Amazon’s NBFC arm and Flipkart are entering India’s lending space, offering consumer and merchant loans, challenging traditional banks."
"india weather news","Southern India is on alert due to Cyclone Ditwah, with heavy rain warnings for Tamil Nadu, Andhra Pradesh, and Puducherry."

"question","answer"
"who is lord shiva","Lord Shiva is one of the principal deities of Hinduism, known as the Destroyer in the Holy Trinity (Brahma, Vishnu, Mahesh). He represents transformation and cosmic energy. Shiva is worshipped in the form of the Shiva Linga and is associated with meditation, Kailash mountain, and cosmic dance (Nataraja)."
"lord shiva powers","Shiva's powers include destruction of evil, creation through cosmic energy, third-eye awakening, control over time, immortality, and supreme yogic power."
